descripcion,imagen,precio,titulo
,,4.000.000,"Schnauzer Miniaturas, Machos, Excelente Genética, Garantía!!"
,,10.000.400,Cachorro Yorkshire Terrier
,,4.000.000,"Hermosos Poodles Minitoys, Somos Centro Veterinario"
,,8.500.000,"Hermosos Labradores Chocolates, Garantia Veterinaria"
,,3.703.200,Cachorros Bulldog Francés Exóticos Y Estandar
,,5.000.000,Bellos Poodle Mini Toy Hembra Y Macho
,,5.000.040,Pdf De Erizos Afric
,,6.000.000,"Se Vende Keneeth, Para Perro De Raza Pequeña"
,,37.000.000,Perro Cachorro Pastor Alemán Macho
,,3.900.000,Golden Retriever Perros Adorno Regalo Arte Moderno
,,10.000.000,Acures-cuy
,,4.000.000,Cachorro Yorkshire Terrier
,,4.000.000,Bulldog Ingles Y Frances
,,3.700.000,Hermoso Cachorros Chihuahua
,,4.002.500,Cachorros Bulldog Ingles Machos Y Hembras Pedigrí Microchip
descripción,precio,título
,360,Cachorros Pastor Alemán Envios A Nivel Nacional
,265,Bichon  Frenchs
,365,Pug Carlino Cachorros
,285,Husky Siberiano Macho Y Hembra 
,400,Cachorros Yorkshire Terrier
,265,Caniche Tacita De Té
,140,Cachorros Golden Retrieve Hembras
,360,Doberman Alemán Envíos A Todo El País
,260,Bellos Husky Siberiano Envios Y Entregas A Nivel Nacional
,190,Cachorros Snhauzer
,150,Cachorros French
,150,French Poodle Mini
,170,Schnauzer Miniaturas Bebes Bellos Padres De Pedigree
,550,Cachorros Shitzu Mini Toys De Linaje
,250,Cachorros De Pastor Alemán 
,285,Husky Siberiano Macho Y Hembra 
,150,Cachorros French Poodle Minitoy Tasita De Té 
,200,Se Vende Cachorros Chow Chow Raza Pura 
,180,Cachorros Husky Siberiano
,265,Caniche Tacita De Té
,265,Caniche Tacita De Té
,350,Cachorros Bichon Maltés Padres De Pedigree 
,350,Ermosos Bichon Maltes Mini
,250,Cachorros Pastor Alemán
,180,Cachorritos Salchichas
descripción,precio,título
,"400.000,66.667",Cachorros Salchicha Miniatura Pelo Corto
,"520.000,43.333",Cachorro Shitzu 
,"27.900,2.325",Perro Con Esmoquin 
,"1.000,167",Schnauzer Miniatura Macho Color Plata Busca Novia Para Cruza
,"850.000,141.667",Rottweiler Cachorra Inscrita Entrega Semana Del 13  Diciembr
,"300.000,50.000",Bulldog Inglés Inscrito Kcc Busca Novia.
,"400.000,66.667",Perritos Salchichas Dachshund Mini
,"400.000,66.667",Cachorros Salchicha Miniatura
,"350.000,29.167",Gran Macho Shih Tzu!! Para Cruza!!
,"400.000,66.667",Lindos Salchicha Mini Dachshund
,"450.000,37.500",Poodle Toy
,"500.000,41.667",Gran Macho Maltés Para Cruza !
,"400.000,66.667",Salchichas Dachshund Muy Mini
,"620.000,103.333","Lindo Machito Inscrito, Kcc"
,"690.000,115.000",Hermosos Machitos Shih Tzu Chiquititos  !!
,"52.349,8.725",Kathe Kruse  Sammy Rye Perro Y Espelta
,"400.000,66.667",Cachorros Bretones Inscritos
,"51.597,8.600",Danita Delimont  Perros  Purebred Rough Collie Perro  Na0
,"98.161,16.360",Perros Shihtzu  Shih Tzu Cachorro  Relojes De Pared
,"75.075,12.512",3drose Rinapiro  Perros  Maltés Lindo Perrito  Escritorio
,"47.762,7.960","Petite Spinner, Color Negro De Perro Salchicha"
,"32.616,5.436",Cachorro De Golden Retriever | Piensa Como Un Perro ~ Per
,"57.013,9.502",Tesoros De La Caroline Viejo Perro Pastor Inglés Limpie S
,"61.374,10.229",Perros Fox Terrier  Fox Terrier   Libro De Dibujo
,"54.318,9.053",Perros West Highland Terrier  West Highland Terrier  Dibu
,"56.376,9.396",Perros Pitbull  Pit Bull Terrier Cachorro  Dibujo Libro
,"38.113,6.352",Perros Bulldog  Bulldog Americano  Hierro Sobre Calor Tra
,"43.474,7.246",Perros Labrador Retriever  Labrador Retriever  Posavasos
,"51.597,8.600",Perros Pitbull  Cachorro Pitbull Terrier Americano  Funda
,"42.520,7.087",3drose Rinapiro  Perros  Maltés Lindo Perrito  Libro De D
,"84.432,14.072",Perros  Cachorro Weimaraner  Braco Posavasos
,"62.405,10.401",Collie De Frontera Perros  Collie De Frontera Bronceado Y
,"39.735,6.622",Danita Delimont  Perros  Pembroke Galés Corgi Puppy Retra
,"37.337,6.223",Nuestro Nombre Es La Taza De Pelo De Perro De Barro 40261
descripción,precio,título
,"400.000,66.667",Cachorros Salchicha Miniatura Pelo Corto
,"27.900,2.325",Perro Con Esmoquin 
,"1.000,167",Schnauzer Miniatura Macho Color Plata Busca Novia Para Cruza
,"850.000,141.667",Rottweiler Cachorra Inscrita Entrega Semana Del 13  Diciembr
,"300.000,50.000",Bulldog Inglés Inscrito Kcc Busca Novia.
,"400.000,66.667",Perritos Salchichas Dachshund Mini
,"400.000,66.667",Cachorros Salchicha Miniatura
,"400.000,66.667",Cachorros Salchicha Miniatura Dachshund
,"350.000,29.167",Gran Macho Shih Tzu!! Para Cruza!!
,"400.000,66.667",Lindos Salchicha Mini Dachshund
,"450.000,37.500",Poodle Toy
,"500.000,41.667",Gran Macho Maltés Para Cruza !
,"400.000,66.667",Salchichas Dachshund Muy Mini
,"620.000,103.333","Lindo Machito Inscrito, Kcc"
,"690.000,115.000",Hermosos Machitos Shih Tzu Chiquititos  !!
,"37.337,6.223",Nuestro Nombre Es La Taza De Pelo De Perro De Barro 40261
,"400.000,66.667",Cachorros Bretones Inscritos
,"98.161,16.360",Perros Shihtzu  Shih Tzu Cachorro  Relojes De Pared
,"75.075,12.512",3drose Rinapiro  Perros  Maltés Lindo Perrito  Escritorio
,"47.762,7.960","Petite Spinner, Color Negro De Perro Salchicha"
,"32.616,5.436",Cachorro De Golden Retriever | Piensa Como Un Perro ~ Per
,"57.013,9.502",Tesoros De La Caroline Viejo Perro Pastor Inglés Limpie S
,"61.374,10.229",Perros Fox Terrier  Fox Terrier   Libro De Dibujo
,"54.318,9.053",Perros West Highland Terrier  West Highland Terrier  Dibu
,"56.376,9.396",Perros Pitbull  Pit Bull Terrier Cachorro  Dibujo Libro
,"38.113,6.352",Perros Bulldog  Bulldog Americano  Hierro Sobre Calor Tra
,"43.474,7.246",Perros Labrador Retriever  Labrador Retriever  Posavasos
,"51.597,8.600",Perros Pitbull  Cachorro Pitbull Terrier Americano  Funda
,"42.520,7.087",3drose Rinapiro  Perros  Maltés Lindo Perrito  Libro De D
,"84.432,14.072",Perros  Cachorro Weimaraner  Braco Posavasos
,"62.405,10.401",Collie De Frontera Perros  Collie De Frontera Bronceado Y
,"39.735,6.622",Danita Delimont  Perros  Pembroke Galés Corgi Puppy Retra
,"52.349,8.725",Kathe Kruse  Sammy Rye Perro Y Espelta
,"55.268,9.211",El Mejor Bulldog Francés Mamá Papá Ever Bundle Paws Perro
